{
  "formato": {
    "nombre": "scorecard-artefacto",
    "version_esquema": "1.0.0"
  },
  "modelo": {
    "id": "sintetico-consumo-scorecard",
    "version": "1.0.0",
    "fecha_construccion": "2026-09-28",
    "descripcion": "Scorecard de consumo, 8 variables (banco de pruebas M21)",
    "target": "1 = malo (90+ DPD a 12 meses)"
  },
  "variables": [
    {
      "nombre": "uso_linea_prom_12m",
      "tipo": "numerico",
      "beta": -0.5125475410452052,
      "bins": [
        {
          "id": 0,
          "tipo": "intervalo",
          "inf": null,
          "sup": 0.19672000000000006,
          "woe": 1.241170193469381,
          "puntos": 86.68768511047028,
          "n_dev": 2013,
          "etiqueta_dev": "(-inf, 0.197]"
        },
        {
          "id": 1,
          "tipo": "intervalo",
          "inf": 0.19672000000000006,
          "sup": 0.31626000000000004,
          "woe": 0.7855706157922852,
          "puntos": 79.94982481791344,
          "n_dev": 2013,
          "etiqueta_dev": "(0.197, 0.316]"
        },
        {
          "id": 2,
          "tipo": "intervalo",
          "inf": 0.31626000000000004,
          "sup": 0.4488400000000001,
          "woe": 0.3992914481108576,
          "puntos": 74.23714378551958,
          "n_dev": 2013,
          "etiqueta_dev": "(0.316, 0.449]"
        },
        {
          "id": 3,
          "tipo": "intervalo",
          "inf": 0.4488400000000001,
          "sup": 0.60482,
          "woe": -0.2436751555881461,
          "puntos": 64.7283133107598,
          "n_dev": 2013,
          "etiqueta_dev": "(0.449, 0.605]"
        },
        {
          "id": 4,
          "tipo": "intervalo",
          "inf": 0.60482,
          "sup": null,
          "woe": -0.993780855772756,
          "puntos": 53.635003175875276,
          "n_dev": 2013,
          "etiqueta_dev": "(0.605, inf]"
        }
      ],
      "no_visto": {
        "woe": 0.0,
        "accion": "revisar"
      },
      "reason_code": "RC01",
      "tendencia_declarada": "decreciente",
      "cierre": "derecha"
    },
    {
      "nombre": "uso_tc_prom_3m",
      "tipo": "numerico",
      "beta": -0.33087658622610594,
      "bins": [
        {
          "id": 0,
          "tipo": "intervalo",
          "inf": null,
          "sup": 0.2036,
          "woe": 1.131500509284957,
          "puntos": 79.13455030165353,
          "n_dev": 2014,
          "etiqueta_dev": "(-inf, 0.204]"
        },
        {
          "id": 1,
          "tipo": "intervalo",
          "inf": 0.2036,
          "sup": 0.3263,
          "woe": 0.6419027338831454,
          "puntos": 74.46032107322382,
          "n_dev": 2013,
          "etiqueta_dev": "(0.204, 0.326]"
        },
        {
          "id": 2,
          "tipo": "intervalo",
          "inf": 0.3263,
          "sup": 0.4489800000000001,
          "woe": 0.16314098127948118,
          "puntos": 69.88954422351756,
          "n_dev": 2012,
          "etiqueta_dev": "(0.326, 0.449]"
        },
        {
          "id": 3,
          "tipo": "intervalo",
          "inf": 0.4489800000000001,
          "sup": 0.6079400000000001,
          "woe": -0.14968094665513298,
          "puntos": 66.90300818861488,
          "n_dev": 2013,
          "etiqueta_dev": "(0.449, 0.608]"
        },
        {
          "id": 4,
          "tipo": "intervalo",
          "inf": 0.6079400000000001,
          "sup": null,
          "woe": -0.886667126295808,
          "puntos": 59.86694202389829,
          "n_dev": 2013,
          "etiqueta_dev": "(0.608, inf]"
        }
      ],
      "no_visto": {
        "woe": 0.0,
        "accion": "revisar"
      },
      "reason_code": "RC02",
      "tendencia_declarada": "decreciente",
      "cierre": "derecha"
    },
    {
      "nombre": "meses_desde_mora_12m",
      "tipo": "numerico",
      "beta": -0.7380894463442795,
      "bins": [
        {
          "id": 0,
          "tipo": "intervalo",
          "inf": null,
          "sup": -9.0,
          "woe": 0.21671124503596362,
          "puntos": 72.94727149639586,
          "n_dev": 2241,
          "etiqueta_dev": "(-inf, -9.0]"
        },
        {
          "id": 1,
          "tipo": "intervalo",
          "inf": -9.0,
          "sup": 3.0,
          "woe": -1.3964843286889566,
          "puntos": 38.591433046795615,
          "n_dev": 492,
          "etiqueta_dev": "(-9.0, 3.0]"
        },
        {
          "id": 2,
          "tipo": "intervalo",
          "inf": 3.0,
          "sup": 8.0,
          "woe": -0.9733447665528532,
          "puntos": 47.602934612483295,
          "n_dev": 838,
          "etiqueta_dev": "(3.0, 8.0]"
        },
        {
          "id": 3,
          "tipo": "intervalo",
          "inf": 8.0,
          "sup": null,
          "woe": -0.6825513819772537,
          "puntos": 53.795891440168795,
          "n_dev": 702,
          "etiqueta_dev": "(8.0, inf]"
        },
        {
          "id": 4,
          "tipo": "valor",
          "valor": 13.0,
          "woe": 0.5179243813964185,
          "puntos": 79.36213527376313,
          "n_dev": 5792,
          "etiqueta_dev": "= 13"
        }
      ],
      "no_visto": {
        "woe": 0.0,
        "accion": "revisar"
      },
      "reason_code": "RC03",
      "tendencia_declarada": null,
      "cierre": "derecha"
    },
    {
      "nombre": "antiguedad_meses",
      "tipo": "numerico",
      "beta": -1.1309712953332092,
      "bins": [
        {
          "id": 0,
          "tipo": "intervalo",
          "inf": null,
          "sup": 28.0,
          "woe": -0.3167790534679567,
          "puntos": 57.99459437862637,
          "n_dev": 2032,
          "etiqueta_dev": "(-inf, 28.0]"
        },
        {
          "id": 1,
          "tipo": "intervalo",
          "inf": 28.0,
          "sup": 46.0,
          "woe": -0.13520714692164384,
          "puntos": 63.9198183455453,
          "n_dev": 2015,
          "etiqueta_dev": "(28.0, 46.0]"
        },
        {
          "id": 2,
          "tipo": "intervalo",
          "inf": 46.0,
          "sup": 67.0,
          "woe": -0.1370475331389496,
          "puntos": 63.85976114434835,
          "n_dev": 2051,
          "etiqueta_dev": "(46.0, 67.0]"
        },
        {
          "id": 3,
          "tipo": "intervalo",
          "inf": 67.0,
          "sup": 98.0,
          "woe": 0.24088564997154432,
          "puntos": 76.19282960771817,
          "n_dev": 1972,
          "etiqueta_dev": "(67.0, 98.0]"
        },
        {
          "id": 4,
          "tipo": "intervalo",
          "inf": 98.0,
          "sup": null,
          "woe": 0.5430376335582214,
          "puntos": 86.05293522016447,
          "n_dev": 1995,
          "etiqueta_dev": "(98.0, inf]"
        }
      ],
      "no_visto": {
        "woe": 0.0,
        "accion": "revisar"
      },
      "reason_code": "RC04",
      "tendencia_declarada": "creciente",
      "cierre": "derecha"
    },
    {
      "nombre": "carga_financiera",
      "tipo": "numerico",
      "beta": -0.4982284540862879,
      "bins": [
        {
          "id": 0,
          "tipo": "intervalo",
          "inf": null,
          "sup": 1.491,
          "woe": 0.5934409426333596,
          "puntos": 76.86323290779245,
          "n_dev": 2015,
          "etiqueta_dev": "(-inf, 1.491]"
        },
        {
          "id": 1,
          "tipo": "intervalo",
          "inf": 1.491,
          "sup": 2.674,
          "woe": 0.1693434459291638,
          "puntos": 70.76647752622677,
          "n_dev": 2013,
          "etiqueta_dev": "(1.491, 2.674]"
        },
        {
          "id": 2,
          "tipo": "intervalo",
          "inf": 2.674,
          "sup": 4.3654,
          "woe": 0.018857705572989544,
          "puntos": 68.60311944348541,
          "n_dev": 2011,
          "etiqueta_dev": "(2.674, 4.365]"
        },
        {
          "id": 3,
          "tipo": "intervalo",
          "inf": 4.3654,
          "sup": 7.889400000000008,
          "woe": -0.20174943581177052,
          "puntos": 65.43170771174516,
          "n_dev": 2013,
          "etiqueta_dev": "(4.365, 7.889]"
        },
        {
          "id": 4,
          "tipo": "intervalo",
          "inf": 7.889400000000008,
          "sup": null,
          "woe": -0.37375814607678387,
          "puntos": 62.95893897782395,
          "n_dev": 2013,
          "etiqueta_dev": "(7.889, inf]"
        }
      ],
      "no_visto": {
        "woe": 0.0,
        "accion": "revisar"
      },
      "reason_code": "RC05",
      "tendencia_declarada": "decreciente",
      "cierre": "derecha"
    },
    {
      "nombre": "consultas_6m",
      "tipo": "numerico",
      "beta": -0.33844943118125487,
      "bins": [
        {
          "id": 0,
          "tipo": "intervalo",
          "inf": null,
          "sup": 1.0,
          "woe": 0.38851430095460804,
          "puntos": 72.12609413321844,
          "n_dev": 6187,
          "etiqueta_dev": "(-inf, 1.0]"
        },
        {
          "id": 1,
          "tipo": "intervalo",
          "inf": 1.0,
          "sup": 2.0,
          "woe": -0.08814809849877371,
          "puntos": 67.47120632626913,
          "n_dev": 2093,
          "etiqueta_dev": "(1.0, 2.0]"
        },
        {
          "id": 2,
          "tipo": "intervalo",
          "inf": 2.0,
          "sup": null,
          "woe": -0.7847704695219129,
          "puntos": 60.66828043020027,
          "n_dev": 1785,
          "etiqueta_dev": "(2.0, inf]"
        }
      ],
      "no_visto": {
        "woe": 0.0,
        "accion": "revisar"
      },
      "reason_code": "RC06",
      "tendencia_declarada": "decreciente",
      "cierre": "derecha"
    },
    {
      "nombre": "canal",
      "tipo": "categorico",
      "beta": -1.1867488879314705,
      "bins": [
        {
          "id": 0,
          "tipo": "categoria",
          "valor": "app",
          "woe": -0.164520912631535,
          "puntos": 62.69844403423466,
          "n_dev": 1459,
          "etiqueta_dev": "app"
        },
        {